"search_term_used","study_id","title","description","organism","relevance_score","url"
"cardiac","GSE112316","Synergistic Axrivation of the Cardiac Enhancer Lanscape during Caridac Reprogramming (RNA-seq data set)","Fibroblasts can be directly reprogrammed toward a cardiac fate by introducing cardiogenic transcription factors (TFs), although the underlying mechanisms of the cardiac reprogramming process remain unclear. Three cardiac TFs, GATA4, MEF2C, and Tbx5 (referred to as GMT) can activate cardiac genes in fibroblasts and their cardiogenic activity is enhanced by the Hand2 TF and the Akt1 kinase. To understand the mechanistic basis of cardiac reprogramming, we performed a genome-wide analysis of cardiog...","Mus musculus","20","https://osdr.nasa.gov/bio/repo/data/studies/GSE112316"
"cardiac","GSE64403","Transcriptional Reversion of Cardiac Myocyte Fate During Mammalian Cardiac Regeneration.","Rationale: Neonatal mice have the capacity to regenerate their hearts in response to injury, but this potential is lost after the first week of life. The transcriptional changes that underpin mammalian cardiac regeneration have not been fully characterized at the molecular level. Objective: The objectives of our study were to determine if myocytes revert the transcriptional phenotype to a less differentiated state during regeneration and to systematically interrogate the transcriptional data to ...","Mus musculus","20","https://osdr.nasa.gov/bio/repo/data/studies/GSE64403"
"cardiac","GSE69726","Myocardin-related transcription factors are required for cardiac development and function","Myocardin-Related Transcription Factors A and B (MRTF-A and MRTF-B) are highly homologous proteins that function as powerful coactivators of serum response factor (SRF), a ubiquitously expressed transcription factor essential for cardiac development. The SRF/MRTF complex binds to CArG boxes found in the control regions of genes that regulate cytoskeletal dynamics and muscle contraction, among other processes. While SRF is required for heart development and function, the role of MRTFs in the deve...","Mus musculus","20","https://osdr.nasa.gov/bio/repo/data/studies/GSE69726"
"cardiac","GSE34274","Gene expression profile of right ventricles from adult wild type and Ezh2-deficient hearts","Adult-onset diseases can be associated with in utero events, but mechanisms for this remain unknown. The polycomb histone methyltransferase, Ezh2, stabilizes transcription by depositing repressive marks during development that persist into adulthood, but its function in postnatal organ homeostasis is unknown. We show that Ezh2 stabilizes cardiac gene expression and prevents cardiac pathology by repressing the homeodomain transcription factor Six1, which functions in cardiac progenitors but is st...","Mus musculus","20","https://osdr.nasa.gov/bio/repo/data/studies/GSE34274"
"cardiac","GSE25757","SAGE analysis of cardiac fibroblasts isolated from adult mouse heart","A total number of 118654 tags was sequenced. After removal of duplicate ditags and linker-derived sequences 110169 tags remained. RNA was prepared from quiescent, serum-starved cardiac fibroblasts in passage 15. Cardiac fibroblasts were isolated from 3-month old C57BL/6 mice.","Mus musculus","20","https://osdr.nasa.gov/bio/repo/data/studies/GSE25757"
"cardiac","GSE12420","Gene profiling of heart atria in PI3K and Mst1 mouse models"," We used microarrays to detail genome-wide gene expression underlying cardiac myocyte pathologies and identified candidate genes and specific pathways affecting cardiac myopathies Keywords: transgenics, cardiac disease analysis","Mus musculus","20","https://osdr.nasa.gov/bio/repo/data/studies/GSE12420"
"blood pressure","GSE85915","Blood pressure regulation by CD4+ lymphocytes expressing choline acetyltransferase","Blood pressure regulation is known to be maintained by a neuro-endocrine circuit, but whether immune cells contribute to blood pressure homeostasis has not been determined. We previously showed that CD4+ T lymphocytes that express choline acetyltransferase (ChAT), which catalyzes the synthesis of the vasorelaxant acetylcholine, relay neural signals. Here we show that these CD4 +CD44hiCD62L lo T helper cells by gene expression are a distinct T-cell population defined by ChAT (CD4 TChAT). Mice lac...","Mus musculus","20","https://osdr.nasa.gov/bio/repo/data/studies/GSE85915"
"blood pressure","GSE87746","Gender differences in the cytokines and chemokines gene expression profiles within the medulla oblongata of SHRs","To unveil the gender differences in the central regulation of blood pressure, we investigated the gene expression profile of cytokines and chemokines in the medulla oblongata of female SHRs compared to that of their male counterparts. Medulla oblongata is a region of the brain containing multiple blood pressure regulation centers, including the nucleus of the solitary tract (NTS), a pivotal region for regulating the set-point of arterial pressure. Our previous findings suggest that the NTS of ma...","Rattus norvegicus","20","https://osdr.nasa.gov/bio/repo/data/studies/GSE87746"
"blood pressure","GSE101977","RNA-seq transcriptonal profiling in mouse hearts under pressure overload","Heart failure is a leading cause of death in US. Hypertension is one of the most important risk factor of heart failure. In the presence of high blood pressure, the heart manifests hypertrophic growth to ameliorate ventricular wall stress. This once adaptive response may progress into decompensation and heart failure. The precise mechanisms governing this transition remain elusive. Here, we take advantage of mouse surgical model transverce aortic constriction (TAC) to induce pressure overload in...","Mus musculus","20","https://osdr.nasa.gov/bio/repo/data/studies/GSE101977"
"blood pressure","GSE5946","High-salt diet leads to differential gene expression in DOCA-treated mice"," In the present study we made use of the (1-renin) DOCA-salt mouse model - which has been previously shown to develop cardiac and renal hypertrophy  - to evaluate the direct effects of high-salt diet on cardiac function and gene expression profiling. The comparison between low-salt and high-salt DOCA-treated mice will reveal what genes are directly modulated by sodium in (normotensive) DOCA-treated mice. Wang Q, Hummler E, Nussberger J, Clement S, Gabbiani G, Brunner HR, Burnier M. Blood pressur...","Mus musculus","20","https://osdr.nasa.gov/bio/repo/data/studies/GSE5946"
"blood pressure","GSE84744","Impairment of cardiac natriuretic peptide signaling develops the excessive cardiac hypertrophy during lactation period","Numerous genes were altered in the postpartum lactating period both in Npr1+/+ and Npr1-/-. Additionally, the involvement of inflammatory responce in the cardiac hypertrophy in lactating-Npr1-/- mice was clarified bythe gene ontology analysis. Two natriuretic peptides, atrial natriuretic peptide (ANP) and brain natriuretic peptide (BNP) act through the common receptor, guanylyl cyclase-A (GC-A) to lower blood pressure, induce diuresis/natriuresis and dilate blood vessels. Recently, we discovered...","Mus musculus","20","https://osdr.nasa.gov/bio/repo/data/studies/GSE84744"
"blood pressure","GSE2739","Effect of AT1 receptor anatagonist on brain microvessels from hypertensive and normotensive rats","In hypertension, abnormal regulation of microcirculation and endothelial dysfunction enhances vulnerability to hypertensive brain damage. In addition to lowering blood pressure, blockade of Angiotensin II AT1 receptors protects against stroke and stress in different animal models and this treatment may be of therapeutic advantage. We studied gene expression using Affymetrix Rat Genome U34A arrays from brain microvessels of spontaneously hypertensive rats (SHR) and their normotensive Wistar Kyoto...","Rattus norvegicus","20","https://osdr.nasa.gov/bio/repo/data/studies/GSE2739"
"circulation","GSE110909","Robust hematopoietic stem cell activity is derived from pre-circulation embryos but not yolk sacs","The embryonic site of definitive hematopoietic stem cell (dHSC) origination has been debated for decades. Although an intra-embryonic origin is supported, recent data suggest that a large fraction of adult blood derives from the yolk sac (YS). Investigating the origins of hematopoiesis before heartbeat onset (i.e. 5-7 somite pairs (sp)) is precluded by a lack of assays that can distinguish dHSC precursors in early embryos. Here, we report robust, multi-lineage and serially transplantable dHSC ac...","Mus musculus","20","https://osdr.nasa.gov/bio/repo/data/studies/GSE110909"
"circulation","GSE17149","Potential mechanisms of low salt diet induced cardiac diseases","We hypothesized that a LS intake leads to a cascade of events involving increases in plasma AII, the AT1 receptor, NADPH oxidase and O2˙ production and ultimately to reduced NO bioactivity. This reduced NO bioactivity results in altered control of the coronary circulation and cardiac metabolism. This study was undertaken to determine the global changes in cardiac gene expression in dogs fed LS diet (0.5% NaCl) for two weeks. Cardiac RNA was extracted from the control and LS fed groups (n=4). Sta...","Canis lupus familiaris","20","https://osdr.nasa.gov/bio/repo/data/studies/GSE17149"
"circulation","GSE108342","Expression Profiles of Long Noncoding RNAs and mRNAs in Post-Cardiac Arrest Rat Brains","To investigate lncRNA and mRNA expression profiles in post-cardiac arrest (CA) brains, an external transthoracic electrical current was applied for eight minutes to induce CA (the CA group). Four rats received sham-operations and served as the blank control (BC) group. Upon return of spontaneous circulation (ROSC), lncRNA and mRNA expression in the rat cerebral cortex was assayed with high-throughput Agilent lncRNA and mRNA microarrays. Thirty-seven lncRNAs were upregulated and 21 lncRNAs were d...","Rattus norvegicus","20","https://osdr.nasa.gov/bio/repo/data/studies/GSE108342"
"human spaceflight","OSD-353","The Effects of Spaceflight Factors on the Human Plasma Proteome, Including Both Real Space Missions and Ground-Based Experiments","The aim of the study was to continue of the proteomic data accumulation on the effects of space flight factors on the human body, including ground-based model experiments. Blood plasma samples were collected from 5 healthy men included in the 21 days head-down bed rest experiment (HDBR) and 5 volunteers participating in a 21 day long dry immersion experiment.","H, o, m, o,  , s, a, p, i, e, n, s","20","https://osdr.nasa.gov/bio/repo/data/studies/OSD-353"
"microgravity human","OSD-670","CI Asteroid Regolith as an In Situ Plant Growth Medium for Space Crop Production","Human expansion into the solar system is currently at the forefront of space research. For our astronauts to survive, they will need to be fed a healthy and nutritious diet on a consistent basis. Right now, our current method of feeding astronauts consists of resupplied prepackaged food from Earth, which is unsustainable for long-term missions. Using planetary resources via in situ resource utilization to grow crops is the next step toward sustainability in space. Asteroids are an abundant space...","R, a, p, h, a, n, u, s,  , s, a, t, i, v, u, s,  ,  ,  ,  ,  , L, a, c, t, u, c, a,  , s, a, t, i, v, a,  ,  ,  ,  ,  , C, a, p, s, i, c, u, m,  , a, n, n, u, u, m","20","https://osdr.nasa.gov/bio/repo/data/studies/OSD-670"
"vascular","PXD002650","Endothelial cell proteomic response to Rickettsia conorii infection","Rickettsia conorii is the etiologic agent of Mediterranean spotted fever, a re-emerging disease with significant mortality.  This obligate, gram-negative intracellular pathogen is transmitted via tick bites, resulting in disseminated vascular endothelial cell infection with vascular leakage. In the infected human, Rickettsia conorii infects endothelial cells, stimulating expression of cytokines and pro-coagulant factors.  However, the integrated proteomic response of human endothelial cells to R...","Homo sapiens (Human)","20","https://osdr.nasa.gov/bio/repo/data/studies/PXD002650"
"vascular","PXD000462","VEGF Study in Primary Human Endothelial Cells","The process of angiogenesis is under complex regulation in adult organisms, particularly as it often occurs in an inflammatory post-wound environment. As such, there are many impacting factors that will regulate the generation of new blood vessels which include not only pro-angiogenic growth factors such as vascular endothelial growth factor, but also angiostatic factors. During initial post-wound hemostasis, a large initial bolus of platelet factor 4 is released into localized areas of damage p...","Homo sapiens (Human)","20","https://osdr.nasa.gov/bio/repo/data/studies/PXD000462"
"vascular","GSE26146","Expression data from cultured human lung tissue-derived fibroblasts and human vascular adventitial fibroblasts","In order to find the difference between human lung tissue-derived fibroblasts and human vascular adventitial fibroblasts for enhancing tumor formation ablity of human lung adenocarcinoma cell line A549, we found that human vascular adventitial fibroblasts enhance A549 tumor formation in vivo compared to human lung tissue-derived fibroblasts.  To find the responsible genes for this phenomena, we used microarray analysis to find the expression difference between lung tissue-derived fibroblasts and...","Homo sapiens","20","https://osdr.nasa.gov/bio/repo/data/studies/GSE26146"
"vascular","PXD012942","N-glycoprotein capture mass spectrometry identifies candidate substrates of human Fut enzymes","How disseminated tumor cells (DTCs) engage specific stromal components in distant organs for survival and outgrowth is a critical but poorly understood step of the metastatic cascade. Previous studies have demonstrated the importance of the epithelial-mesenchymal transition (EMT) in promoting the cancer stem cell properties needed for metastasis initiation, while the reverse process of mesenchymal-epithelial transition (MET) is required for metastatic outgrowth. Here we report that this paradoxi...","Homo sapiens (Human)","20","https://osdr.nasa.gov/bio/repo/data/studies/PXD012942"
"vascular","GSE69637","RNA-seq identifies novel lncRNAs involved in vascular smooth muscle cell proliferation","Smooth muscle cell (SMC) phenotypic switching from a contractile to a synthetic state is implicated in diverse vascular pathologies, including neointimal formation. This study was designed to identify lncRNAs that may play a role in vascular pathologies. Primary smooth muscle cells cultured from surplus human saphenous vein tissue were treated with inflammatory and proliferative stimuli, IL1α and PDGF, for 72h and RNA extracted for RNA-sequencing. Using edgeR processed data we found expression o...","Homo sapiens","20","https://osdr.nasa.gov/bio/repo/data/studies/GSE69637"
"heart","PXD000774","Mitral Valve Tissue Shotgun Proteomics","In this study, we carried out a large-scale proteome profiling of human mitral valve tissues resected from patients with mitral valve prolapse.","Homo sapiens (Human)","19","https://osdr.nasa.gov/bio/repo/data/studies/PXD000774"
"astronaut health","OSD-640","Combined space stressors induce independent behavioral deficits predicted by early peripheral blood monocytes (flow cytometry)","Interplanetary space travel poses many hazards to the human body. To protect astronaut health and performance on critical missions, there is first a need to understand the effects of deep space hazards, including ionizing radiation, confinement, and altered gravity. Previous studies of rodents exposed to a single such stressor document significant deficits, but our study is the first to investigate possible cumulative and synergistic impacts of simultaneous ionizing radiation, confinement, and a...","M, u, s,  , m, u, s, c, u, l, u, s","19","https://osdr.nasa.gov/bio/repo/data/studies/OSD-640"
"astronaut health","OSD-618","Combined space stressors induce independent behavioral deficits predicted by early peripheral blood monocytes (Behavioral Assays)","Interplanetary space travel poses many hazards to the human body. To protect astronaut health and performance on critical missions, there is first a need to understand the effects of deep space hazards, including ionizing radiation, confinement, and altered gravity. Previous studies of rodents exposed to a single such stressor document significant deficits, but our study is the first to investigate possible cumulative and synergistic impacts of simultaneous ionizing radiation, confinement, and a...","M, u, s,  , m, u, s, c, u, l, u, s","19","https://osdr.nasa.gov/bio/repo/data/studies/OSD-618"
"human spaceflight","OSD-66","Microbial Observatory (ISS-MO): Antimicrobial resistance genes","The environmental samples were collected with the polyester wipes from eight different locations in the International Space Station (ISS) during two consecutive sampling sessions (three months apart) within the ISS Microbial Observatory Experiment. DNA extracted from each of the samples was used to create amplicon libraries based on customized panel of 500 antimicrobial resistance genes followed by next-generation sequencing. This is the first study of that shows the reservoir of antimicrobial g...","c, e, l, l, u, l, a, r,  , o, r, g, a, n, i, s, m, s","19","https://osdr.nasa.gov/bio/repo/data/studies/OSD-66"
"space medicine","GSE80324","Expression profiling of cell growth on different layers","Human embryonic stem cells (hESCs) and induced pluripotent stem cells (hiPSCs) hold great promise for applications in drug discovery and regenerative medicine. While tremendous ongoing efforts are focused on establishing more optimal cellular microenvironments for hESCs/hiPSCs to facilitate their differentiation into the specific phenotypical functions of interests, it is still challenging to systematically determine the optimal environment and the circumstances supporting each environment, due ...","Homo sapiens","19","https://osdr.nasa.gov/bio/repo/data/studies/GSE80324"
"vascular","PXD007707","Proteomic Profiling Exosomes from Vascular Smooth Muscle Cell","The components of the exosomes are essential to understand how vascular smooth muscle cells (VSMC) and endothelial cells communicate with each other. Exosomes secreted by human VSMCs were harvested and analyzed by nanoLC-MS/MS. The activity of the identified proteins were further assessed by the in vivo matrigel plug angiogenesis assay.","Homo sapiens (Human)","19","https://osdr.nasa.gov/bio/repo/data/studies/PXD007707"
"vascular","PXD001025","Basement Membranes from Human Retinal Blood Vessels, Inner Limiting Membranes, and Lens Capsules","Three types of BMs from adult human eyes, the inner limiting membrane, the retinal vascular BMs and the lens capsule, were isolated for analysis by 1D-SDS-PAGE and LC-MS/MS.","Homo sapiens (Human)","19","https://osdr.nasa.gov/bio/repo/data/studies/PXD001025"
"vascular","GSE37145","Vascular properties of breast cancer intrinsic subtypes","Interactions of cancer cells with the vasculature are essential for tumor growth and likely promote metastatic progression. Endothelial cell content and lympho-vascular invasion are generally associated with tumor aggressiveness, however, these features are generally not employed in the clinic. We aimed to determine if endothelial cell gene expression signatures could be utilized to better characterize breast tumor biology, and to establish if vascular cell-derived signatures could provide infor...","Homo sapiens","19","https://osdr.nasa.gov/bio/repo/data/studies/GSE37145"
"vascular","GSE116121","Pro-angiogenic Ginsenoside F1 and Rh1 Inhibit Vascular Leakage by Modulating NR4A1","Angiogenesis is an essential process in human physiology and disease pathology. Particularly, in ischemic disease condition, the proper induction of angiogenesis without vascular leakage will be crucial for its effective therapy. Ginsenosides, triterpenoid saponins from a well-known medicinal plant ginseng, have been considered as a strong candidate for modulating angiogenesis. However, the biologic activity of individual gensenoside compounds and their target pathway have not been elucidated sy...","Homo sapiens","19","https://osdr.nasa.gov/bio/repo/data/studies/GSE116121"
"vascular","GSE47553","Effect of progerin on p53-deficient vascular smooth muscle cells","Analysis of p53-deficient (E6-expressing) human vascular smooth muscle cells (VSMCs) that express progerin, a mutated form of lamin A resposible for Hutchinson- Gilford progeria syndrome (HGPS). p53 pathway is associated with HGPS. Results provide insight into molecular mechanisms underlying vascular dysfunction of HGPS caused by other than p53 pathway.","Homo sapiens","19","https://osdr.nasa.gov/bio/repo/data/studies/GSE47553"
"vascular","PXD005972","Angiogenic and Immunologic Proteins Identified by Deep Proteomic Profiling of Human Choroidal and Retinal Vascular Endothelial Cells","PURPOSE Diseases that involve choroidal or retinal endothelial vascular cells are leading causes of vision loss: age-related macular degeneration, retinal ischemic vasculopathies and non-infectious posterior uveitis. Proteins differentially expressed by these endothelial cell populations are potential drug targets. We used deep proteomics to define the molecular phenotype of human choroidal and retinal endothelial cells at the protein level.  METHODS Choroidal and retinal endothelial cells were ...","Homo sapiens (Human)","19","https://osdr.nasa.gov/bio/repo/data/studies/PXD005972"
"vascular","GSE11367","Effect of IL-17 on human vascular smooth muscle cells","Keywords: Dose response Investigate the effect of recombinant human IL-17A on vascular smooth muscle cells cultured from human aortas.","Homo sapiens","19","https://osdr.nasa.gov/bio/repo/data/studies/GSE11367"
"vascular","GSE59326","Expression profiling in primary and stem-cell derived Human Endothelial and Vascular Smooth Muscle Cells","Whole transcriptome gene expression profiling of Normal Human Endothelial and Vascular Smooth Muscle Cells","Homo sapiens","19","https://osdr.nasa.gov/bio/repo/data/studies/GSE59326"
"vascular","GSE31981","Gene expression profiling of human vascular cells following gene transfer","For further understanding of the gene expression profile of human vascular cells following gene transfer in vitro, we have employed whole genome microarray expression profiling as a discovery platform to identify gene families or single genes with the potential to distinguish between responders and non-responders to a particular gene therapy. Human vascular cells from deseased donors were derived and transduced in vitro. Total RNA was isolated from the cells and subjected to microarray analysis ...","Homo sapiens","19","https://osdr.nasa.gov/bio/repo/data/studies/GSE31981"
"vascular","GSE77279","The long non-coding RNA(lncRNA)  expression profiles in human aortic vascular smooth muscle cells (HAVSMCs)","To explore the potential involvement of lncRNAs in the vascular smooth muscle cell (VSMC) proliferation, we conducted lncRNA profiling in three pairs of proliferative HAVSMCs and quiescent HAVSMCs by microarray. Our results showed that lncRNAs were aberrantly expressed in proliferative HAVSMCs compared with quiescent HAVSMCs, and provided potential targets for novel insights into VSMC proliferation or vascular remodeling diseases.","Homo sapiens","19","https://osdr.nasa.gov/bio/repo/data/studies/GSE77279"
"vascular","GSE77278","The circular RNA (circRNA)  expression profiles in human aortic vascular smooth muscle cells (HAVSMCs)","To explore the potential involvement of circRNAs in the vascular smooth muscle cell (VSMC) proliferation, we conducted circRNA profiling in three pairs of proliferative HAVSMCs and quiescent HAVSMCs by microarray. Our results showed that circRNAs were aberrantly expressed in proliferative HAVSMCs compared with quiescent HAVSMCs, and provided potential targets for novel insights into VSMC proliferation or vascular remodeling diseases.","Homo sapiens","19","https://osdr.nasa.gov/bio/repo/data/studies/GSE77278"
"vascular","GSE33768","S100A8 treatment on gene expression of human umbilical vascular endothelial cells.","Previous studies showed that S100A8 and S100A9 are involved in neovascularization as well as in tumor development. At high concentrations, S100A8 and S100A9 cause inflammatory response or apoptosis mediated damage in vascular endothelial cells. But the effect of low concentrations of such proteins on endothelial cells remains unknown. This assay was performed to screen for genes that are involved in the response of Human Unbilican Vascular Endothelial Cells to low concentrations of S100A8.","Homo sapiens","19","https://osdr.nasa.gov/bio/repo/data/studies/GSE33768"
"vascular","GSE55149","Human umbilical vascular endothelial cells: control vs. safrole oxide treatment","Safrole oxide (SFO) at 50 μg/ml could most effectively induce EndoMT within 12 h. Transcriptional profiling of control and SFO-treated Human umbilical vascular endothelial cells was analyzed to understand the underlying molecular mechanism","Homo sapiens","19","https://osdr.nasa.gov/bio/repo/data/studies/GSE55149"
