"search_term_used","study_id","title","description","organism","relevance_score","url"
"human spaceflight","OSD-635","Spaceflight effects on human vascular smooth muscle cell phenotype and function","The cardiovascular system is strongly impacted by the hazards of spaceflight. Astronauts spending steadily increasing lengths of time in microgravity are subject to cardiovascular deconditioning resulting in loss of vascular tone, reduced total blood volume, and diminished cardiac output. Appreciating the mechanisms by which the cells of the vasculature are altered during spaceflight will be integral to understanding and combating these deleterious effects as the human presence in space advances...","H, o, m, o,  , s, a, p, i, e, n, s","56","https://osdr.nasa.gov/bio/repo/data/studies/OSD-635"
"cardiovascular","PXD008278","Serum proteomics of Premature Carotid atherosclerosis: The Cardiovascular Risk in Young Finns Study","Cardiovascular diseases represent a leading cause of 
deaths globally; of which atherosclerosis is a major contributor. 
Selective retention of circulating apolipoprotein B particles in the sub 
endothelial space by arterial wall proteoglycans and their subsequent 
modification is currently thought to be a hallmark of the disease. The 
exact mechanism responsible for lesion development is not fully 
understood. Currently, ultrasonic assessment of carotid artery intima 
media thickness (IM...","Homo sapiens (Human)","53","https://osdr.nasa.gov/bio/repo/data/studies/PXD008278"
"cardiovascular","GSE100725","In vivo generation of post-infarct human cardiac muscle by laminin-promoted cardiovascular progenitors","This SuperSeries is composed of the SubSeries listed below and contains: bulk RNA-seq of two time series of a xeno-free human cardiomyocyte differentiation protocol starting from HS1001 and H1 hECSs until day 94 cardiomyocytes, single cell sequencing of cardiovascular progenitors (H1 and HS1001-derived cardiovascular progenitors at day 9 and 11) and bulk RNA-Seq of H1 hECSs that have been transferred to a LN-221 matrix. Regeneration of injured human heart muscle is limited and an unmet clinical ...","Homo sapiens","52","https://osdr.nasa.gov/bio/repo/data/studies/GSE100725"
"human spaceflight","GSE137081","Effects of Spaceflight on Human Induced Pluripotent Stem Cell-Derived Cardiomyocyte Structure and Function","With extended stays aboard the International Space Station (ISS) becoming commonplace, there is a need to better understand the effects of microgravity on cardiac function. We utilized human induced pluripotent stem cell-derived cardiomyocytes (hiPSC-CMs) to study the effects of microgravity on cell-level cardiac function and gene expression. The hiPSC-CMs were cultured aboard the ISS for 5.5 weeks and their gene expression, structure, and functions were compared to ground control hiPSC-CMs. Exp...","Homo sapiens","51","https://osdr.nasa.gov/bio/repo/data/studies/GSE137081"
"human spaceflight","GSE100931","SCD – Stem Cell Differentiation on board the International Space Station [RNA-seq]","This disease is frequent in aged people, but develops much more rapidly in space. Our experiment, selected by ESA (European Space Agency), aimed to determine how human bone marrow mesenchymal stem cells (hBMSCs) react and differentiate in real microgravity, on board the International Space Station, in approx. 2 weeks time. The bone loss observed in astronauts and animal models after spaceflight is attributable to alterations in the bone tissue formation that depends from the continuous remodelin...","Homo sapiens","51","https://osdr.nasa.gov/bio/repo/data/studies/GSE100931"
"human spaceflight","GSE100930","SCD – Stem Cell Differentiation on board the International Space Station [microarray on total RNA]","This disease is frequent in aged people, but develops much more rapidly in space. Our experiment, selected by ESA (European Space Agency), aimed to determine how human bone marrow mesenchymal stem cells (hBMSCs) react and differentiate in real microgravity, on board the International Space Station, in approx. 2 weeks time. The bone loss observed in astronauts and animal models after spaceflight is attributable to alterations in the bone tissue formation that depends from the continuous remodelin...","Homo sapiens","51","https://osdr.nasa.gov/bio/repo/data/studies/GSE100930"
"human spaceflight","GSE100932","SCD – Stem Cell Differentiation on board the International Space Station [miRNA-seq on miRNAs from exosomes]","The bone loss observed in astronauts and animal models after spaceflight is attributable to alterations in the bone tissue formation that depends from the continuous remodeling through the activities of bone-resorbing osteoclasts of hematopoietic lineage and bone-forming osteoblasts of mesenchymal origin. This disease is frequent in aged people, but develops much more rapidly in space. Our experiment, selected by ESA (European Space Agency), aimed to determine how human bone marrow mesenchymal s...","Homo sapiens","51","https://osdr.nasa.gov/bio/repo/data/studies/GSE100932"
"cardiovascular","GSE37824","Evaluation of a novel clinical platform for cardiovascular drug development","Objectives –To determine whether inflammation biomarkers can be used as indicators of therapeutic response, an exploratory study was performed to ascertain whether short term improvements in risk parameters will have measureable effects on a pre-defined panel of plaque inflammation biomarkers. Conclusions – Short term treatment with drugs that improve cardiovascular risk parameters did not result in a measureable reduction in the levels of peripheral arterial plaque inflammation biomarkers.  Fur...","Homo sapiens","50","https://osdr.nasa.gov/bio/repo/data/studies/GSE37824"
"heart","PXD011742","Mechanism of 17-β Estradiol Stimulated Integration of Human Mesenchymal Stem Cells in Heart Tissue","Scarcity of gender specific donor hearts highlights the importance of mesenchymal stem cells (MSCs) as a therapeutic tool for heart repair. However, inefficient incorporation, retention, and activity of MSCs in cardiac tissue remains an obstacle. Since surge in follicular estradiol (μmolar-range) triggers tissue remodeling (e.g. ovulation) and estradiol exerts beneficial actions on the cardiovascular system, we hypothesized that estradiol may promote/improve MSC-mediated cardiac repair processes...","Homo sapiens (Human)","50","https://osdr.nasa.gov/bio/repo/data/studies/PXD011742"
"cardiovascular","OSD-575","SpaceX Inspiration4 Blood Serum Metabolic Panel and Immune/Cardiac Cytokine Arrays (Comprehensive Metabolic Panel and Multiplex)","The SpaceX Inspiration4 mission was a 3-day mission with four private astronauts to low Earth orbit that occurred in September 2021. The crew collected biospecimen samples before, during, and after flight. One of these biospecimen collections included whole blood collected via venipuncture, with serum extracted from blood using a serum separator tube (SST). Samples were collected pre-flight (L-92, L-44, L-3) and post-flight (R+1, R+45, R+82). Serum samples were submitted for immune and cardiovas...","H, o, m, o,  , s, a, p, i, e, n, s","49","https://osdr.nasa.gov/bio/repo/data/studies/OSD-575"
"cardiovascular","GSE43805","TMEM88 knockdown during human embryonic stem cell cardiac differentiation","TMEM88 is indispensable for heart development and acts in the pre-cardiac mesoderm to specify lineage commitment of the cardiovascular progenitor cell through inhibition of Wnt signaling.","Homo sapiens","49","https://osdr.nasa.gov/bio/repo/data/studies/GSE43805"
"cardiac","PXD001888","Mouse heart toxicity","Background Sunitinib is a small molecule tyrosine kinase inhibitor approved for the treatment of diverse cancers. Despite widespread clinical approval the associated cardiovascular toxicity sequelae are of concern; high grade toxicities may lead to dose reduction, interruption or discontinuation. Thus, an effective strategy for the early detection of cardiac damage in the context of sunitinib treatment is warranted. Although yet to be fully elucidated, molecular pathways and kinases implicate in...","Mus musculus (Mouse)","49","https://osdr.nasa.gov/bio/repo/data/studies/PXD001888"
"blood pressure","GSE86882","Cardioprotection and lifespan extension by the natural polyamine spermidine","Aging is associated with an increased risk of cardiovascular disease and death. Here we show that oral supplementation of the natural polyamine spermidine extends lifespan, while it exerts cardioprotective effects through reduction of cardiac hypertrophy and preservation of diastolic function in old mice. Spermidine feeding enhanced cardiac autophagy, mitophagy, mitochondrial respiration and mechano-elastical properties of cardiomyocytes in vivo, coinciding with increased titin phosphorylation a...","Mus musculus","47","https://osdr.nasa.gov/bio/repo/data/studies/GSE86882"
"human spaceflight","OSD-599","Transcriptomic Effects on the Mouse Heart Following 30 Days on the International Space Station.","Efforts to understand the impact of spaceflight on the human body stem from growing interest in long-term space travel. Multiple organ systems are affected by microgravity and radiation, including the cardiovascular system. Previous transcriptomic studies have sought to reveal the changes in gene expression after spaceflight. However, little is known about the impact of long-term spaceflight on the mouse heart in vivo. This study focuses on the transcriptomic changes in the hearts of female C57B...","M, u, s,  , m, u, s, c, u, l, u, s","47","https://osdr.nasa.gov/bio/repo/data/studies/OSD-599"
"human spaceflight","GSE14798","Woman skeletal muscle transcriptome with bed rest and countermeasures.","Microgravity has a dramatic impact on human physiology, illustrated in particular with skeletal muscle impairment. A thorough understanding of the mechanisms leading to loss of muscle mass and structural disorders is necessary for the definition of efficient clinical and spaceflight countermeasures. We investigated the effects of long-term bed rest on transcriptome of soleus (SOL) and vastus lateralis (VL) muscles in healthy women (BRC group, n=8), and the potential beneficial impact of protein ...","Homo sapiens","46","https://osdr.nasa.gov/bio/repo/data/studies/GSE14798"
"cardiovascular","GSE97709","Plasma transcriptome profiling in patients with chronic kidney disease and end-stage renal disease","Cardiovascular disease is the major cause of morbidity and death in patients with chronic kidney disease (CKD) and end-stage renal disease (ESRD). Patients with CKD and ESRD are at high risk for myocardial dysfunction, ischemia and heart failure. The mechanisms linking impaired renal function and increased risk for cardiovascular diseases, however, remain elusive. In addition, conventional therapeutics proven effective in reducing cardiovascular events in general population fail to provide simil...","Homo sapiens","45","https://osdr.nasa.gov/bio/repo/data/studies/GSE97709"
"heart","PXD005736","Proteomic Analysis of Human Cardiac Organoids","The mammalian heart undergoes major transitions during postnatal life to acquire the physiological properties of an adult organ. Postnatal life imposes numerous adaptations including electrophysiological, structural and metabolic maturation of cardiomyocytes1, which occur coincident with loss of proliferative capacity and regenerative potential2,3. The discovery of key upstream drivers of cardiomyocyte maturation and cell cycle arrest remains one of the most important unanswered questions in car...","Homo sapiens (Human)","45","https://osdr.nasa.gov/bio/repo/data/studies/PXD005736"
"blood pressure","GSE67077","Deletion of Rictor in brain and fat alters peripheral clock gene expression and increases blood pressure","The mammalian target of rapamycin complex 2 (mTORC2) contains the essential protein RICTOR and is activated by growth factors. mTORC2 in adipose tissue contributes to regulating glucose and lipid metabolism. In the perivascular adipose tissue (PVAT) mTORC2 ensures normal vascular reactivity by controlling expression of inflammatory molecules. To assess whether RICTOR/mTORC2 contributes to blood pressure regulation, we applied a radiotelemetry approach in control and Rictor knockout (RictoraP2KO)...","Mus musculus","45","https://osdr.nasa.gov/bio/repo/data/studies/GSE67077"
"blood pressure","GSE77378","OBESITY ALTERS MOLECULAR AND FUNCTIONAL CARDIAC RESPONSES TO ISCHEMIA-REPERFUSION AND GLUCAGON-LIKE PEPTIDE-1 RECEPTOR AGONISM","This study tested the hypothesis that obesity alters the left ventricular microRNA (miR) transcriptome, proteome and functional cardiac response to ischemia-reperfusion (I/R) injury and to glucagon like peptide-1 (GLP-1) receptor activation. Ossabaw swine were fed normal chow or obesogenic diet for 6 months followed by IV infusion of either saline (vehicle) or the GLP-1 mimetic exendin-4 (Ex-4).  Left ventricular pressure volume relationships were assessed under baseline conditions, during a 30-...","synthetic construct","44","https://osdr.nasa.gov/bio/repo/data/studies/GSE77378"
"cardiovascular","GSE38511","Aspirin Exposure Reveals Novel Genes Associated with Platelet Function and Cardiovascular Events (outpatient cardiology)","This accession represents the OPC cohort microarray data Background: Identifying individuals at heightened cardiovascular risk is a priority for reducing the global burden of cardiovascular disease.  Aspirin is widely used to prevent cardiovascular events, though with variable results.  Therefore, we hypothesized that aspirin exposure would reveal novel biological pathways relevant to the development of cardiovascular events.  Methods: We administered aspirin, followed by peripheral blood RNA mi...","Homo sapiens","42","https://osdr.nasa.gov/bio/repo/data/studies/GSE38511"
"cardiovascular","GSE137500","An atheroprotective transcriptome induced by JQ1 (a BRD4 inhibitor) in human endothelial cells","The bromodomain and extra terminal domain (BET) family of proteins, including BRD2, BRD3, and BRD4, play a key role in many cellular processes, including inflammatory gene expression, mitosis, and viral/host interaction by controlling the assembly of histone acetylation-dependent chromatin complexes. Previous studies have shown that multiple BET inhibitors (BETi), including JQ1, have therapeutic effects in cancer and cardiovascular diseases. Some BETi have entered different phases of clinical tr...","Homo sapiens","42","https://osdr.nasa.gov/bio/repo/data/studies/GSE137500"
"heart","PXD006675","Region and cell-type resolved quantitative proteomic map of the human heart and its application to atrial fibrillation","The heart is a central human organ and its diseases are the leading cause of death worldwide, but an in-depth knowledge of the identity and quantity of its constituent proteins is still lacking. Here we determine the healthy human heart proteome by measuring 16 anatomical regions and three major cardiac cell types by high-resolution mass spectrometry-based proteomics. From low microgram sample amounts, we quantified over 11,000 proteins in this high dynamic range tissue. We combined copy numbers...","Homo sapiens (Human)","42","https://osdr.nasa.gov/bio/repo/data/studies/PXD006675"
"cardiac","GSE43588","Reprogramming of human fibroblasts toward a cardiac fate","Reprogramming of mouse fibroblasts toward a myocardial cell fate by forced expression of cardiac transcription factors or microRNAs has recently been demonstrated.  The potential clinical applicability of these findings is based on the minimal regenerative potential of the adult human heart and the limited availability of human heart tissue.  An initial, but mandatory step toward clinical application of this approach is to establish conditions for conversion of adult human fibroblasts to a cardi...","Homo sapiens","42","https://osdr.nasa.gov/bio/repo/data/studies/GSE43588"
"blood pressure","GSE75940","LncVSM (AK098656) up/down-regulation in Vascular Smooth Muscle cells","Long non-coding RNAs (LncRNAs) in hypertensives and their mechanisms in regulating blood pressure still remain unexplored.  The aim of present study is to construct the profiles of LncRNAs in blood of patients with essential hypertension and healthy controls.   Methods and results, LncRNA microarray identified up-regulated, anddown-regulated LncRNAs, in hypertensives compared to their healthy controls. Among them, one vascular smooth muscle (VSM)-specific LncRNA AK096656 (LncVSM) was quantitated...","Homo sapiens","42","https://osdr.nasa.gov/bio/repo/data/studies/GSE75940"
"microgravity human","GSE136939","Expression of miRNA, lncRNA and mRNA in human lymphoblastoid TK6 cells under simulated microgravity after ionizing radiation","In space, multiple unique environmental factors, particularly microgravity and space radiation, pose constant threat to the astronaut’s health. To gain insight into the role of miRNAs and lncRNAs in response to radiation and microgravity, we analyzed RNA expression profiles in human lymphoblastoid TK6 cells incubated for 24 h in static condition or in rotating condition to stimulate microgravity in space after 2 Gy γ-ray irradiation. Expression of 14 lncRNAs and 17 mRNAs was found to be signific...","Homo sapiens","42","https://osdr.nasa.gov/bio/repo/data/studies/GSE136939"
"cardiac","GSE12486","Changes in cardiac transcription profiles following on-pump coronary artery bypass grafting","Keywords: human, cardiac, CABG coronary surgery, gene expression, cardiopulmonary bypass. To investigate changes in cardiac transcription profiles caused by on-pump cardiac surgery, we collected myocardial samples, prior and after grafting, from patients undergoing on-pump coronary artery bypass grafting with cardiopulmonary bypass and cardiac arrest. The transcriptional profile of the mRNA in these samples was measured with gene array technology. Changes in transcriptional profiles can be corre...","Homo sapiens","41","https://osdr.nasa.gov/bio/repo/data/studies/GSE12486"
"blood pressure","GSE60538","Sox5 and Sox6 direct a cardiac adaptive response to pressure overload","Conclusions: Unlike in skeletal muscle, our results suggest Sox5 but not Sox6 to be a major regulator of cardiac function and rhythm. Sox5 is essential to preserve cardiac function under normal conditions by maintaining contractility and to prevent cardiac failure after pressure overload. Methods and Results: Using Sox5 and Sox6 cardiac-specific and Sox5 conduction system-specific knockout mice, we investigated the role of the two transcription factors in the heart under normal conditions and du...","Mus musculus","41","https://osdr.nasa.gov/bio/repo/data/studies/GSE60538"
"astronaut health","OSD-484","Astronauts plasma-derived exosomes induced gene expression in AC16 cells","There are unique stressors in the spaceflight environment. Exposure to such stressors is associated with adverse effects on astronauts' health, including increased cancer and cardiovascular disease risks. Small extracellular vesicles (sEVs, i.e., exosomes) play a vital role in intercellular communication and regulate various biological processes contributing to their role in disease pathogenesis. To assess whether spaceflight alters sEVs transcriptome profile, sEVs were isolated from the blood p...","H, o, m, o,  , s, a, p, i, e, n, s","41","https://osdr.nasa.gov/bio/repo/data/studies/OSD-484"
"human spaceflight","GSE38836","T Cell Activation in Microgravity Compared to 1g (Earth's) Gravity","This study tested the hypothesis that transcription of immediate early genes is inhibited in T cells activated in microgravity (mg).  Immunosuppression during spaceflight is a major barrier to safe long-term human space habitation and travel.  The goals of these experiments were to prove that mg was the cause of impaired T cell activation during spaceflight as well as understand the mechanisms controlling early T cell activation.  T cells from 4 human donors were stimulated with concanavalin A (...","Homo sapiens","41","https://osdr.nasa.gov/bio/repo/data/studies/GSE38836"
"microgravity human","GSE20173","Gene expression profiling of PBL in response to ionising radiation and modeled microgravity","BACKGROUND: Ionizing radiation (IR) can be extremely harmful for human cells since an improper DNA-damage response (DDR) to IR can contribute to carcinogenesis initiation. Perturbations in DDR pathway can originate from alteration in the functionality of the microRNA-mediated gene regulation, being microRNAs (miRNAs) small noncoding RNA that act as post-transcriptional regulators of gene expression. In this study we gained insight into the role of miRNAs in the regulation of DDR to IR under micr...","Homo sapiens","41","https://osdr.nasa.gov/bio/repo/data/studies/GSE20173"
"microgravity human","GSE20120","Identification of miRNAs involved in cell response to ionising radiation and modeled microgravity","BACKGROUND: Ionizing radiation (IR) can be extremely harmful for human cells since an improper DNA-damage response (DDR) to IR can contribute to carcinogenesis initiation. Perturbations in DDR pathway can originate from alteration in the functionality of the microRNA-mediated gene regulation, being microRNAs (miRNAs) small noncoding RNA that act as post-transcriptional regulators of gene expression. In this study we gained insight into the role of miRNAs in the regulation of DDR to IR under micr...","Homo sapiens","41","https://osdr.nasa.gov/bio/repo/data/studies/GSE20120"
"cardiovascular","GSE65795","Real-time quantitative PCR analysis of microRNA expression in neonatal cardiovascular progenitors before and after 7 Days of simulated microgravity.","Human cardiovascular progenitors were isolated from neonatal (<1 month old) atrial tissue and cloned by single cell dilution.  MicroRNA expression in neonatal cardiovascular progenitor cell (CPC) clones was compared before and after exposure to simulated microgravity using sabiosciences cell development & differentiation miRNA PCR array.","Homo sapiens","40","https://osdr.nasa.gov/bio/repo/data/studies/GSE65795"
"astronaut health","OSD-812","Simulated microgravity impairs human NK cell cytotoxic activity against space radiation-relevant leukemic cells.","Natural killer (NK) cells are an important first-line of defense against malignant cells. Because of the potential for increased cancer risk from astronaut exposure to space radiation, we determined whether microgravity present during spaceflight affects the body's defenses against leukemogenesis. Human NK cells were cultured for 48 h under normal gravity and simulated microgravity (sμG), and cytotoxicity against K-562 (CML) and MOLT-4 (T-ALL) cells was measured using standard methodology or und...","H, o, m, o,  , s, a, p, i, e, n, s","40","https://osdr.nasa.gov/bio/repo/data/studies/OSD-812"
"human spaceflight","PXD005823","Comparative proteomic analysis and bioluminescent reporter gene assays to investigate effects of  simulated microgravity on Caco-2 cells","Microgravity is one of the most important features in spaceflight. Previous evidence has shown that significant changes  to the musculoskeletal and immune systems occurred under microgravity. The present study was undertaken to explore the change in protein abundance in human colon colorectal cells that were incubated for 48 or 72 h either in normal conditions and µG simulated conditions. The comparative proteomic method based on the 18O labeling technique was applied to investigate the up-regul...","Homo sapiens (Human)","40","https://osdr.nasa.gov/bio/repo/data/studies/PXD005823"
"human spaceflight","OSD-624","Arabidopsis transcriptome in Virgin Galactic human-tended suborbital spaceflight","The Virgin Galactic Unity 22 mission conducted the first astronaut-manipulated suborbital spaceflight experiment. The experiment examined the operationalization of Kennedy Space Center Fixation Tubes (KFTs) as a generalizable approach to preserving biology at various phases of suborbital flight. The biology chosen for this experiment was Arabidopsis thaliana, ecotype Col-0, because of the plant’s history of spaceflight experimentation within KFTs and wealth of comparative data from orbital exper...","A, r, a, b, i, d, o, p, s, i, s,  , t, h, a, l, i, a, n, a","40","https://osdr.nasa.gov/bio/repo/data/studies/OSD-624"
"human spaceflight","GSE54213","Immune responses to the in vitro LPS assault engineered in the spaceflight multi-omics study"," Present study though compromised by the small sample size was able to shade lights on several aspects of immunological responses to the endotoxic assault mediated by μG. Implementing the host-pathogen interactions in the spaceflight and subsequently lysing the cells onboard presented the critical distinguishing features of the present study from the past reports. Microgravity alters the immune response to in vitro LPS assault engineered in spaceflight: A multi-omics study Microgravity can facil...","Homo sapiens","40","https://osdr.nasa.gov/bio/repo/data/studies/GSE54213"
"human spaceflight","OSD-530","Cell-free RNA analysis of plasma samples collected from six astronauts in JAXA Cell-Free Epigenome (CFE) Study","A detailed understanding of how the human body responds to spaceflight will be important to develop countermeasures for long-term space exploration. Liquid biopsies offer minimally invasive alternatives to traditional tissue biopsies, while also permitting the extraction of cell-free nucleic acids, which may resolve molecular heterogeneity and extend the multi-omics scope better than standard methods. Full-body molecular profiling using cell-free nucleic acids isolated from liquid biopsies is he...","H, o, m, o,  , s, a, p, i, e, n, s","40","https://osdr.nasa.gov/bio/repo/data/studies/OSD-530"
