"search_term_used","study_id","title","description","organism","relevance_score","url"
"circulation","GSE75534","Human B-1 and pre-plamablast like cells Gene Expression Array","Human B-1 cells (CD20+CD27+CD43+CD38lo/int) and pre-plasmablast like cells (CD20+CD27hiCD38hi) are new antibody secreting cells identified in circulation. We used microarray to compare and contrast expressed genes between these two cell population","Homo sapiens","28","https://osdr.nasa.gov/bio/repo/data/studies/GSE75534"
"circulation","GSE49035","De novo sequencing of circulating microRNAs in locally advanced breast cancer","MicroRNAs (miRNAs) have been recently detected in the circulation of cancer patients, where they are associated with clinical parameters. Discovery profiling of circulating small RNAs has not been previously reported in breast cancer (BC), and was carried out in this study to identify blood-based small RNA markers of BC clinical outcome.","Homo sapiens","28","https://osdr.nasa.gov/bio/repo/data/studies/GSE49035"
"circulation","GSE46326","Preimplantation Factor Effect on Endometrial and Decidual Cells","Embryos secrete preimplantation factor (PIF), a peptide present in maternal circulation during viable pregnancy.  We compared downstream synthetic PIF effect on gene expression in non-pregnant Human Endometrial Stromal Cell (HESC) and First Trimester Decidual cell (FTDC) culture to mimic the maternal intrauterine environment during embryo implantation and trophoblast invasion.","Homo sapiens","28","https://osdr.nasa.gov/bio/repo/data/studies/GSE46326"
"circulation","PXD008665","The impact of circulating preeclampsia-associated extracellular vesicles on the migratory activity and phenotype of THP-1 monocytic cells","Intercellular communication via extracellular vesicles (EVs) is a highly dynamic and specific process. The interaction between EVs and their  target cells, especially immune cells, results in functional and phenotype changes that consequently may play a significant role in various  physiological states and the pathogenesis of immune-mediated disorders. Monocytes are the most prominent environment sensing immune cells in  circulation, skilled to shape their microenvironments via cytokine secretio...","Homo sapiens (Human)","28","https://osdr.nasa.gov/bio/repo/data/studies/PXD008665"
"circulation","GSE84791","Gene expression analysis of human macrophages exposed to lipoprotein lipase hydrolysis products","Lipoprotein lipase (LPL) is an extracellular lipase that preferentially hydrolyses triglycerides in triglyceride-rich lipoproteins within the circulation. LPL expression in macrophages contributes to atherosclerosis. In addition, the hydrolysis products liberated from lipoprotein lipids by LPL causes lipid accumulation and impairs cholesterol efflux ability in macrophages. However, the effects of LPL hydrolysis products in modulating the transcript profiles within macrophages and their roles in ...","Homo sapiens","28","https://osdr.nasa.gov/bio/repo/data/studies/GSE84791"
"circulation","GSE59697","Gene expression signatures of human plasma cells isolated from different territories","In vivo antigen (Ag)-induced differentiation of B lymphocytes into plasma cells (PCs) takes place in extra-follicular foci and germinal centers of the secondary lymphoid organs (SLOs). Most of these SLO PCs are short-living and only relatively few PCs, characterized by secreting high-affinity antibodies (Ab), travel through the circulation and finally home in specialized survival niches of the bone marrow (BM) and, at a lesser extent, in the SLOs, where they become long-living Ab-secreting PCs. ...","Homo sapiens","28","https://osdr.nasa.gov/bio/repo/data/studies/GSE59697"
"astronaut health","OSD-415","Serum metabolomics associating with circulating microRNA profiles reveal the role of miR-383-5p in rat hippocampus under simulated microgravity","Microgravity impacts various aspects of human health. Yet the mechanisms of spaceflight-induced health problems are not elucidated. Here we mapped the fusion systemic analysis of the serum metabolome and the circulating microRNAome in a hindlimb unloading rat model to simulate microgravity. The response of serum metabolites and microRNAs to simulated microgravity (SMG) was striking. Integrated pathway analysis of altered serum metabolites and target genes of the significantly altered circulating...","R, a, t, t, u, s,  , n, o, r, v, e, g, i, c, u, s","28","https://osdr.nasa.gov/bio/repo/data/studies/OSD-415"
"microgravity human","GSE56647","Human Peripheral Blood Lymphcoyte(PBL): Simulated Microgravity  vs. Control","Transcriptional profiling of human peripheral blood  lymphocyte comparing simulated microgravity for 72 hours with untreated control.","Homo sapiens","28","https://osdr.nasa.gov/bio/repo/data/studies/GSE56647"
"microgravity human","GSE4209","Changes in Expression of Genes Involved in Apoptosis in Activated Human T-Cells in Response to Modeled  Microgravity","The purpose of this study was to search for microgravity-sensitive genes, specifically for apoptotic genes influenced by the microgravity environment and other genes related to immune response. Keywords: stress response","Homo sapiens","28","https://osdr.nasa.gov/bio/repo/data/studies/GSE4209"
"microgravity human","GSE65477","A study of alterations in DNA epigenetic modifications (5mC and 5hmC) and gene expression influenced by simulated microgravity in human lymphoblastoid cells [meDIP-seq]","Here, in this study we systematically examined the patterns of DNA methylation and hydroxy-methylation with its functional implications in gene regulation for the cultured TK6 lymphoblastoid cells upon exposure to micro-gravity conditions. theThe results reported here indicate that simulated microgravity alters methylation  patterns in a limited way  and subsequently the expression of genes involved in stress response like ATF3, FBXO17, MAP3K13 and VCL in TK6 cells.","Homo sapiens","28","https://osdr.nasa.gov/bio/repo/data/studies/GSE65477"
"microgravity human","GSE65943","A study of alterations in DNA epigenetic modifications (5mC and 5hmC) and gene expression influenced by simulated microgravity in human lymphoblastoid cells [RNA-seq]","Here, in this study we systematically examined the patterns of DNA methylation and hydroxy-methylation with its functional implications in gene regulation for the cultured TK6 lymphoblastoid cells upon exposure to micro-gravity conditions. The results reported here indicate that simulated microgravity alters methylation  patterns in a limited way  and subsequently the expression of genes involved in stress response like ATF3, FBXO17, MAP3K13 and VCL in TK6 cells.","Homo sapiens","28","https://osdr.nasa.gov/bio/repo/data/studies/GSE65943"
"microgravity human","GSE65944","A study of alterations in DNA epigenetic modifications (5mC and 5hmC) and gene expression influenced by simulated microgravity in human lymphoblastoid cells","This SuperSeries is composed of the SubSeries listed below.","Homo sapiens","28","https://osdr.nasa.gov/bio/repo/data/studies/GSE65944"
"microgravity human","GSE101299","Dynamic gene expression response to altered gravity in human myelomonocytic U937 cells [sounding rocket]","We investigated differentially regulated genes in human myelomonocytic U937 cells in 20s and 5min microgravity and in hypergravity and compared expression profiles to identify potential gravity-regulated genes and adaptation processes.","Homo sapiens","28","https://osdr.nasa.gov/bio/repo/data/studies/GSE101299"
"microgravity human","GSE118107","Modeling Malignant Bone Disease Using Microgravity Bioreactors, Genetically Engineered Cell Lines, Patient-Derived Tumor Xenografts and Stem Cells","Transcriptome data from mesenchymal stem cells cultured in osteogenic conditions on monolayers of microcarriers coated with collagen I or extracellular matrix derived from osteogenically enhanced human mesenchymal stem cells (hereafter referred to as hMatrix)","Homo sapiens","28","https://osdr.nasa.gov/bio/repo/data/studies/GSE118107"
"microgravity human","GSE101101","Gene expression response to simulated gravity and hypergravity in human T cells","We investigated differentially regulated and stably expressed genes in human Jurkat T lymphocytic cells in 5min simulated microgravity and hypergravity and compared expression profiles to identify  gravity-regulated and unaffected genes as well as adaptation processes.","Homo sapiens","28","https://osdr.nasa.gov/bio/repo/data/studies/GSE101101"
"microgravity human","GSE101212","Dynamic gene expression response to altered gravity in human myelomonocytic U937 cells [parabolic]","We investigated differentially regulated genes in human myelomonocytic U937 cells in 20s and 5min microgravity and in hypergravity and compared expression profiles to identify potential gravity-regulated genes and adaptation processes.","Homo sapiens","28","https://osdr.nasa.gov/bio/repo/data/studies/GSE101212"
"microgravity human","GSE57400","microRNA expression profiles in human peripheral blood lymphocytes cultured in modeled microgravity","In the present study we analyzed miRNA and mRNA expression profiles in human peripheral blood lymphocytes (PBLs) incubated in microgravity condition, simulated by a ground-based Rotating Wall Vessel (RWV) bioreactor. Our results show that 42 miRNAs were differentially expressed in MMG-incubated PBLs compared with 1g-incubated ones. Among these, miR-9-5p, miR-9-3p, miR-155-5p, miR-150-3p, and miR-378-3p were the most dysregulated. To improve the detection of functional miRNA-mRNA pairs we perform...","Homo sapiens","28","https://osdr.nasa.gov/bio/repo/data/studies/GSE57400"
"microgravity human","GSE57418","Integration analysis of microRNA and mRNA expression profiles in human peripheral blood lymphocytes cultured in modeled microgravity","In the present study we analyzed miRNA and mRNA expression profiles in human peripheral blood lymphocytes (PBLs) incubated in microgravity condition, simulated by a ground-based Rotating Wall Vessel (RWV) bioreactor. Our results show that 42 miRNAs were differentially expressed in MMG-incubated PBLs compared with 1g-incubated ones. Among these, miR-9-5p, miR-9-3p, miR-155-5p, miR-150-3p, and miR-378-3p were the most dysregulated. To improve the detection of functional miRNA-mRNA pairs we perform...","Homo sapiens","28","https://osdr.nasa.gov/bio/repo/data/studies/GSE57418"
"microgravity human","GSE57408","Gene expression profiling of human peripheral blood lymphocytes cultured in modeled microgravity","In the present study we analyzed miRNA and mRNA expression profiles in human peripheral blood lymphocytes (PBLs) incubated in microgravity condition, simulated by a ground-based Rotating Wall Vessel (RWV) bioreactor. Our results show that 42 miRNAs were differentially expressed in MMG-incubated PBLs compared with 1g-incubated ones. Among these, miR-9-5p, miR-9-3p, miR-155-5p, miR-150-3p, and miR-378-3p were the most dysregulated. To improve the detection of functional miRNA-mRNA pairs we perform...","Homo sapiens","28","https://osdr.nasa.gov/bio/repo/data/studies/GSE57408"
"cardiovascular","mgp15104","NARCH_Periodontal","Periodontal disease (PD) is a well-known risk factor for cardiovascular disease (CVD) but the casual relationship is unclear. American Indians/Alaskan Natives (AI/AN) have high rate of both PD and CVD and a better understanding of how PD might affect heart health would be particularly helpful in this population. In this study, we sequenced the bacterial biofilms of periodontal (gum) pockets and used metagenomic sequencing and vascular health measurements (immune cytokine profiles and vascular fl...","N/A","27","https://osdr.nasa.gov/bio/repo/data/studies/mgp15104"
"cardiovascular","GSE117400","Embryonic ionizing radiation exposure results in expression alterations of genes associated with cardiovascular and neurological development, function, and disease and modified cardiovascular function in zebrafish","The relationship between ionizing radiation (IR) and carcinogenesis is long established, but recently the association between IR and other diseases is starting to be recognized. Currently, there is limited information on the genetic mechanisms governing the role of IR in non-cancer related adverse health effects and in regards to an early developmental exposure. In this study, zebrafish embryos were exposed to a range of IR doses (0, 1, 2, 5, 10 Gy) at 26 hours post fertilization (hpf). No signi...","Danio rerio","27","https://osdr.nasa.gov/bio/repo/data/studies/GSE117400"
"blood pressure","GSE137786","Molecular determinants of nephron vascular specialization in the kidney","The kidney vasculature is specialized to filter waste products from the blood, regulate blood pressure, and balance electrolytes. Although recent advances in stem cell studies have enabled the partial generation of kidney tissues in vitro, recapitulating the complex vascular structures of the kidney remains a daunting task. The molecular pathways that specify and sustain kidney vascular heterogeneity to perform these diverse tasks are not well characterized. Here, we have employed high throughpu...","Homo sapiens, Mus musculus","27","https://osdr.nasa.gov/bio/repo/data/studies/GSE137786"
"circulation","GSE134713","Proteinase-Activated Receptor 4 (PAR4) mediates cell membrane blebbing in a Gaq/11, Gai independent, RhoA and ß-arrestin-dependent manner.","To gain a comprehensive understanding of *-arrestin mediated signaling downstream of PAR4 and to guide future studies, we undertook RNAseq analysis of PAR4 activated genes in control cells and in cells lacking *-arrestin-1/-2. The results of this analysis revealed PAR4 regulation of genes involved in processes including blood coagulation and circulation, cell-cell adhesion, sensory perception and neuron-neuron synaptic transmission, terms that relates back to known function of PAR4.","Homo sapiens","27","https://osdr.nasa.gov/bio/repo/data/studies/GSE134713"
"astronaut health","OSD-481","New insights into the role of lncRNA after spaceflight","We analyzed the transcriptional profile by RNA-sequencing of exosomal content isolated from blood plasma of three astronauts who flew on various ISS missions between 1998-2001. Computational analysis of the transcriptome of these exosomes identified 27 differentially expressed lncRNAs with possible functions and clinical implications.","H, o, m, o,  , s, a, p, i, e, n, s","27","https://osdr.nasa.gov/bio/repo/data/studies/OSD-481"
"human spaceflight","GSE50881","Candida albicans response to spaceflight (NASA STS-115)","This study presents the first global transcriptional profiling and phenotypic characterization of the major human opportunistic fungal pathogen, Candida albicans, grown in spaceflight conditions. Microarray analysis revealed that C. albicans subjected to short-term spaceflight culture differentially regulated 454 genes compared to synchronous ground controls, which represented 8.4% of the analyzed ORFs. Spaceflight-cultured C. albicans induced genes involved in cell aggregation (similar to flocc...","Candida albicans","27","https://osdr.nasa.gov/bio/repo/data/studies/GSE50881"
"human spaceflight","OSD-316","Plasticity of the human IgM repertoire in response to a long-term spaceflight","Immune dysregulation is among the main adverse outcomes of spaceflight. Despite its crucial role in host protection, effects on the human antibody repertoire are unknown. Consequently, we examined the IgM repertoire of five cosmonauts 25 days before launch, after 64 and 129 days spent on the International Space Station (ISS), and after 1, 7 and 30 days of Earth reambulation using high-throughput sequencing. This is the first study of this kind. Our data revealed that the IgM repertoire of cosmon...","H, o, m, o,  , s, a, p, i, e, n, s","27","https://osdr.nasa.gov/bio/repo/data/studies/OSD-316"
"human spaceflight","OSD-20","Candida albicans response to spaceflight (NASA STS-115)","This study presents the first global transcriptional profiling and phenotypic characterization of the major human opportunistic fungal pathogen, Candida albicans, grown in spaceflight conditions. Microarray analysis revealed that C. albicans subjected to short-term spaceflight culture differentially regulated 454 genes compared to synchronous ground controls, which represented 8.4% of the analyzed ORFs. Spaceflight-cultured C. albicans induced genes involved in cell aggregation (similar to flocc...","C, a, n, d, i, d, a,  , a, l, b, i, c, a, n, s","27","https://osdr.nasa.gov/bio/repo/data/studies/OSD-20"
"human spaceflight","OSD-52","Expression data from SPHINX (SPaceflight of Huvec: an INtegrated eXperiment)","Changes in the physical environment modulate cell responses and may lead to the impairment or even failure of tissue function as a result of mechanotransduction processes. It has been suggested that this situation occurs in some age-related diseases and some pathological conditions observed in space, such as cardiovascular deconditioning, bone loss, muscle atrophy, and impaired immune responses. All of these are associated with endothelial dysfunction but the precise mechanism is still unclear. ...","H, o, m, o,  , s, a, p, i, e, n, s","27","https://osdr.nasa.gov/bio/repo/data/studies/OSD-52"
"human spaceflight","OSD-83","Comparative Transcriptomic Analysis of Adult Medaka Tissues Sampled after Adaptation to a Space Environment","To understand how humans adapt to space environments, many experiments can be conducted on astronauts while they work aboard the Space Shuttle or the International Space Station (ISS). We also need animal experiments that can apply to human models and help prevent or solve the physical issues we face in space travel. The medaka is a suitable model fish for studying space adaptation because in the second International Microgravity Laboratory mission in 1994, adult fish mated successfully in space...","O, r, y, z, i, a, s,  , l, a, t, i, p, e, s","27","https://osdr.nasa.gov/bio/repo/data/studies/OSD-83"
"human spaceflight","OSD-689","Single-cell analysis identifies conserved features of immune dysfunction in simulated microgravity and spaceflight","Microgravity is associated with immunological dysfunction, though the mechanisms are poorly understood. Here, using single-cell analysis of human peripheral blood mononuclear cells (PBMCs) exposed to short term (25 hours) simulated microgravity, we characterize altered genes and pathways at basal and stimulated states with a Toll-like Receptor-7/8 agonist. We validate single-cell analysis by RNA sequencing and super-resolution microscopy, and against data from the Inspiration-4 (I4) mission, JAX...","H, o, m, o,  , s, a, p, i, e, n, s","27","https://osdr.nasa.gov/bio/repo/data/studies/OSD-689"
"microgravity human","OSD-545","Expression of miRNA, lncRNA and mRNA in human lymphoblastoid TK6 cells under simulated microgravity after ionizing radiation","In space, multiple unique environmental factors, particularly microgravity and space radiation, pose constant threat to the astronaut’s health. To gain insight into the role of miRNAs and lncRNAs in response to radiation and microgravity, we analyzed RNA expression profiles in human lymphoblastoid TK6 cells incubated for 24 h in static condition or in rotating condition to stimulate microgravity in space after 2 Gy γ-ray irradiation. Expression of 14 lncRNAs and 17 mRNAs was found to be signific...","H, o, m, o,  , s, a, p, i, e, n, s","27","https://osdr.nasa.gov/bio/repo/data/studies/OSD-545"
"arterial stiffness","GSE87199","Disturbed flow promotes arterial stiffening through thrombospondin-1 (TSP-1) signaling pathways","Arterial stiffness is a prevalent, independent cardiovascular risk factor, but the underlying mechanisms are not well understood. Wall shear stress and shear-sensitive genes may promote arterial stiffening through clinically important signaling pathways. Our goal was to identify how disturbed blood flow leads to arterial stiffness using the mouse partial carotid ligation model. Here we used our in vivo partial carotid ligation model to induce d-flow in the LCA while the contralateral RCA continu...","Mus musculus","27","https://osdr.nasa.gov/bio/repo/data/studies/GSE87199"
"cardiovascular","PXD001861","platelet hyperreactivity project","The aim of this study is to identify candidate genes modulating platelet reactivity in aspirin-treated cardiovascular patients using an integrative network-based approach. Platelet reactivity was assessed in 110 cardiovascular patients treated with aspirin 100mg/d by aggregometry using several agonists. Patients with extreme high or low PR were selected for further analysis. Data derived from quantitative proteomic of platelets and platelet sub-cellular fractions, as well as from transcriptomic ...","Homo sapiens (Human)","26","https://osdr.nasa.gov/bio/repo/data/studies/PXD001861"
"cardiovascular","PXD008467","Plasma proteomics reveals the confounding effect of heparin administration on the analysis of candidate cardiovascular biomarkers - Cohort1","Several plasma proteins have been suggested as markers for a variety of cardiovascular conditions but fail to qualify in independent patient cohorts. One reason may relate to interference of medication on plasma protein levels. In the present study we applied a proteomic approach to identify plasma proteins that changed in concentration with heparin administration and therefore potentially may confound their as biomarkers in situations where heparin is used.","Homo sapiens (Human)","26","https://osdr.nasa.gov/bio/repo/data/studies/PXD008467"
"cardiovascular","PXD008468","Plasma proteomics reveals the confounding effect of heparin administration on the analysis of candidate cardiovascular biomarkers - Cohort2","Several plasma proteins have been suggested as markers for a variety of cardiovascular conditions but fail to qualify in independent patient cohorts. One reason may relate to interference of medication on plasma protein levels. In the present study we applied a proteomic approach to identify plasma proteins that changed in concentration with heparin administration and therefore potentially may confound their as biomarkers in situations where heparin is used.","Homo sapiens (Human)","26","https://osdr.nasa.gov/bio/repo/data/studies/PXD008468"
"cardiovascular","PXD003902","VEGF orchestration of the p130Cas Interactome","p130Cas is a polyvalent adapter protein essential for cardiovascular development, and with a key role in cell movement. In order to identify the pathways by which p130Cas exerts its biological functions in endothelial cells we mapped the p130Cas interactome and its dynamic changes in response to VEGF using high-resolution mass spectrometry and reconstruction of protein interaction (PPI) networks with the aid of multiple PPI databases. The work presented here was based on a collaboration between ...","Homo sapiens (Human)","26","https://osdr.nasa.gov/bio/repo/data/studies/PXD003902"
"cardiovascular","GSE136431","Early quantification of systemic inflammatory (INF) and cardiovascular disease (CVD) proteins predicts long-term treatment response to Tofacitinib and Etanercept (CVD data set)","Proteomic profiles of 91 cardiovascular disease proteins were measured in the blood of psoriasis patients both before and after treatment with tofacitanib or etanercept. These proteomic profiles were used to develop statistical classifiers for predicting PASI75 responses to tofacitinib and etancercept","Homo sapiens","26","https://osdr.nasa.gov/bio/repo/data/studies/GSE136431"
"cardiovascular","GSE46262","Studies on progenitor endothelial cells; exploring mechanisms for improvement of cardiovascular diseases","Transcriptomic analysis of primary CD34+ cells. CD34+ cell were induced in vitro with hypoxia (3 hours), high glucose and high glucose plus hypoxia. Subsequently, the effect of metformin (anti-diabetic drug) on all conditions was studied to take advantage of transcriptomics to prospectively explore the mechanism of this drug to reduce the risk of cardiovascular diseases in type II diabetic patients.","Homo sapiens","26","https://osdr.nasa.gov/bio/repo/data/studies/GSE46262"
"cardiovascular","GSE66175","Imporatance of substantial weight loss for altering gene expression during intensive cardiovascular lifestyle modification","In contrast, participants losing minimal weight (-3.1+2.5%) showed only minor changes in cardiovascular risk factors and markers of inflammation, and no changes in gene expression compared to non-intervention controls after 1 year. Weight loss (>10%) during lifestyle modification is associated with down-regulation of genetic pathways governing interactions between circulating immune cells and the vascular endothelium and may be required to successfully reduce CVD risk. The objective of this stud...","Homo sapiens","26","https://osdr.nasa.gov/bio/repo/data/studies/GSE66175"
"cardiovascular","PXD010404","A combination of proteomic approaches identifies a panel of circulating extracellular vesicle proteins related to the risk of suffering cardiovascular disease in obese patients","Plasma-derived extracellular vesicles (EVs) have been extensively described as putative biomarkers in different diseases. More precisely, increased levels of EVs subpopulations are well-known to associate with obesity. The goal of this study was to identify EVs-derived biomarkers in plasma from obese patients in order to predict the development of pathological events associated with obesity. The study was performed combining two different proteomic approaches (2D-DIGE and label-free LC-MS/MS). S...","Homo sapiens (Human)","26","https://osdr.nasa.gov/bio/repo/data/studies/PXD010404"
